{
  "id": "level-205",
  "name": "Level 205 — 虚空之室",
  "number": 205,
  "category": "normal",
  "difficultyClass": 1,
  "environment": "void",
  "aesthetic": "dreamcore",
  "light": "dim",
  "sanDrain": 0.02,
  "description": "几间红石砖砌成的房间，门和窗户通往纯粹的虚空。没有实体——只有安静，安静得让你听见自己的心跳。在这里待久了，你会开始怀疑墙的另一侧是否真的存在。",
  "palette": {
    "primary": "#8a4e3a",
    "secondary": "#5c3428",
    "accent": "#2e1c14",
    "light": "#e8b8a0"
  },
  "terrain": {
    "width": 26,
    "height": 26,
    "roomCount": 8,
    "roomSizeMin": 4,
    "roomSizeMax": 7,
    "corridorWidth": 2,
    "wallStyle": "brick",
    "floorStyle": "tile",
    "extraFeatures": [
      "doors",
      "puddles"
    ],
    "infinite": false
  },
  "spaceRules": [
    "euclidean"
  ],
  "entities": [],
  "items": [
    "almond-water",
    "royal-ration",
    "note"
  ],
  "itemDensity": 0.02,
  "setPieces": [
    {
      "type": "writing",
      "position": "random",
      "text": "有人用指甲在墙上刻了一行字：『别从窗户往外看太久。』",
      "sanityEffect": -2,
      "note": "墙上刻着：别从窗户往外看太久。"
    },
    {
      "type": "weird-room",
      "position": "random",
      "text": "窗外的虚空里飘着一样东西，像一本书。你看了很久，它飘近了一点。",
      "sanityEffect": -4,
      "note": "虚空里的书在靠近。"
    },
    {
      "type": "writing",
      "position": "random",
      "text": "门框上有一道新刻的记号。你数了数墙上的旧记号——它们每天多一道，但你从没见人刻过。",
      "sanityEffect": -5,
      "note": "门框的记号每天增加。"
    }
  ],
  "soundscape": {
    "ambient": [
      "虚空的风声（其实没有风）",
      "自己的心跳"
    ],
    "startles": [
      "远处传来一声闷响，像什么东西掉进了虚空"
    ],
    "silenceEvents": true
  },
  "exits": [
    {
      "kind": "noclip",
      "target": "level-404",
      "hidden": true,
      "danger": false,
      "description": "一扇通向虚空的门——你推开门，走进的却是另一个房间。"
    },
    {
      "kind": "noclip",
      "target": "level-hub",
      "hidden": false,
      "danger": false,
      "description": "一扇亮着暖光的门，正常得可疑。"
    },
    {
      "kind": "noclip",
      "target": "level-188",
      "hidden": true,
      "danger": false,
      "description": "红砖墙的裂缝——挤进去，是一间白色小房。"
    }
  ]
}
